{
  "$schema": "https://json-schema.org/draft/2020-12/schema",
  "$id": "https://myshell.dev/schemas/command-group-v1.schema.json",
  "title": "MyShell Command Group v1",
  "type": "object",
  "additionalProperties": false,
  "required": ["schemaVersion", "id", "name", "commands", "createdAt", "updatedAt"],
  "properties": {
    "schemaVersion": { "const": 1 },
    "id": { "type": "string", "format": "uuid" },
    "name": { "type": "string", "minLength": 1, "maxLength": 200 },
    "commands": {
      "type": "array",
      "maxItems": 100,
      "items": {
        "type": "object",
        "additionalProperties": false,
        "required": ["id", "name", "text"],
        "properties": {
          "id": { "type": "string", "format": "uuid" },
          "name": { "type": "string", "minLength": 1, "maxLength": 200 },
          "text": { "type": "string", "minLength": 1, "maxLength": 10000 }
        }
      }
    },
    "createdAt": { "type": "string", "format": "date-time" },
    "updatedAt": { "type": "string", "format": "date-time" }
  }
}
